{
  "$schema": "https://json-schema.org/draft/2020-12/schema",
  "title": "legacy-standards-archive-aistd.v1",
  "type": "object",
  "additionalProperties": false,
  "required": [
    "version",
    "kind",
    "generated_at",
    "archive_root",
    "snapshot_id",
    "items"
  ],
  "properties": {
    "version": {
      "const": "v1"
    },
    "kind": {
      "const": "legacy-standards-archive-aistd"
    },
    "generated_at": {
      "type": "string",
      "minLength": 1
    },
    "archive_root": {
      "type": "string",
      "minLength": 1
    },
    "snapshot_id": {
      "type": "string",
      "minLength": 1
    },
    "items": {
      "type": "array",
      "items": {
        "type": "object",
        "additionalProperties": false,
        "required": [
          "source_id",
          "source_path",
          "archived_path",
          "sha256_source",
          "sha256_archive",
          "status"
        ],
        "properties": {
          "source_id": {
            "type": "string",
            "minLength": 1
          },
          "source_path": {
            "type": "string",
            "minLength": 1
          },
          "archived_path": {
            "type": "string",
            "minLength": 1
          },
          "sha256_source": {
            "type": "string",
            "pattern": "^[a-f0-9]{64}$"
          },
          "sha256_archive": {
            "type": "string",
            "pattern": "^[a-f0-9]{64}$"
          },
          "status": {
            "type": "string",
            "enum": [
              "ARCHIVED"
            ]
          }
        }
      }
    },
    "missing_sources": {
      "type": "array",
      "items": {
        "type": "string"
      }
    },
    "notes": {
      "type": "array",
      "items": {
        "type": "string"
      }
    }
  }
}
